{
  "isoDate": "2026-01-20",
  "image": "/images/news/news-1.jpg",
  "type": "announcement",
  "en": {
    "title": "Sisyphus Studio — We Are Officially Open",
    "date": "Jan 20, 2026",
    "summary": "Sisyphus Studio opens its doors. We are a small team ready to take on complex challenges. Our goal is to create deep, well‑crafted games that respect the player’s intelligence and leave a lasting impression.",
    "body": "Sisyphus Studio opens its doors. We are a small team ready to take on complex challenges. Our goal is to create deep, well‑crafted games that respect the player’s intelligence and leave a lasting impression.\n\nOur story began in August 2025 with a team of three people and an ambitious goal — to create a large‑scale modification for a popular game. But we quickly ran into a fundamental problem: trying to implement our creative and technical ideas on top of someone else’s product was a path of compromises and “duct‑tape” solutions.\n\nSeeing that even the best mods on the market suffered from optimization issues, we made a key decision in November of that year: instead of patching up someone else’s foundation, we would build our own.\n\nWe realized that creating games from scratch is an order of magnitude more difficult, but we were inspired by complete creative freedom, the ability to personally answer for the quality of the product, and boundless opportunities for professional growth. That choice became the philosophy of Sisyphus Studio: we create an environment that fuels ambition at every level. Experienced professionals get not just tasks, but creative freedom and the chance to add a landmark commercial project to their portfolio, expanding their expertise at the intersection of different disciplines. At the same time, ambitious beginners find fertile ground for growth here, learning from masters of the craft while working on real‑world tasks.\n\nAnd so our story began. The story of a team that consciously chose the difficult path for the sake of high ideals!"
  },
  "ru": {
    "title": "Sisyphus Studio — мы официально открылись",
    "date": "20 Янв, 2026",
    "summary": "Sisyphus Studio открывает свои двери. Мы — небольшая команда, готовая браться за сложные задачи. Наша цель — создавать глубокие, проработанные игры, которые уважают интеллект игрока и оставляют после себя яркие впечатления.",
    "body": "Sisyphus Studio открывает свои двери. Мы — небольшая команда, готовая браться за сложные задачи. Наша цель — создавать глубокие, проработанные игры, которые уважают интеллект игрока и оставляют после себя яркие впечатления.\n\nНаша история началась в августе 2025 года с команды из трех человек и амбициозной цели — создать масштабную модификацию для популярной игры. Однако мы быстро столкнулись с фундаментальной проблемой: попытка реализовать наши творческие и технические идеи на базе чужого продукта была путем компромиссов и «костылей».\n\nУвидев, что даже лучшие моды на рынке страдают от проблем с оптимизацией, в ноябре того же года мы приняли ключевое решение: вместо того чтобы латать чужой фундамент, мы построим свой собственный.\n\nМы осознавали, что создание игр с нуля — это задача на порядок сложнее, но нас вдохновляли полная творческая свобода, возможность лично отвечать за качество продукта и безграничные перспективы для профессионального роста. Этот выбор и стал философией Sisyphus Studio: мы создаем среду, которая питает амбиции на любом уровне. Опытные профессионалы получают у нас не просто задачи, а творческую свободу и возможность пополнить портфолио знаковым коммерческим проектом, расширяя компетенции на стыке разных дисциплин. В то же время амбициозные новички находят здесь плодотворную почву для роста, перенимая опыт у мастеров своего дела в работе над реальными задачами.\n\nТак началась наша история. История команды, которая сознательно выбрала сложный путь ради высоких идей!"
  }
}
