{
  "isoDate": "2026-04-16",
  "image": "/images/news/news-2.jpg",
  "type": "dev-diary",
  "en": {
    "title": "Development Diary 2",
    "date": "Apr 16, 2026",
    "summary": "Development Diary #2: Research on CAD-to-Blender pipelines and polygon mesh optimization.",
    "body": "In indie development, optimization is not just a final polish before release — it is the foundation on which the entire content creation process is built. Recently, our 3D designer conducted a major study focused on a problem many studios face: the loss of mesh quality when transferring CAD models into Blender.\n\nWith standard export (for example, to OBJ format), mathematically perfect CAD geometry often turns into chaos: extra triangles appear, edge density becomes uneven, and artifacts show up on fillets. That complicates further work with shading and UVs and hurts in-game performance. We decided not to accept this and tested several pipelines using a complex model with many chamfers — a vintage Coca-Cola Vendo refrigerator.\n\nKey findings from our research:\n\nBasic export (OBJ): The fastest but lowest-quality approach. The mesh ends up uneven; corners and chamfers get covered in excess polygons, requiring long manual cleanup.\n\nPlasticity Bridge: A great tool for fast iterations and real-time geometry checks. With tuned parameters, triangle count drops significantly (in our test — from 62K to 16K), but complex areas still retain unnecessary cuts.\n\nProcessing through PIXYZ: The clear winner of our testing. The software preserves edge-flow logic and drastically reduces polygon count (down to 6.8K triangles in our case), producing a clean mesh that is almost ready for a game engine.\n\nThe secret ingredient: We found that tessellation quality depends not only on software. Adding extra guide sections at the CAD modeling stage \"hints\" to the program how to interpret complex shapes, minimizing artifacts.\n\nWhat does this mean for our project?\n\nIntegrating PIXYZ together with preparatory guide edges in CAD completely changes our hard-surface asset pipeline.\n\nFirst, we save hours of routine work. Modelers no longer need to manually clean generated meshes (retopology), freeing time for new mechanics and detail work. Second, we get highly optimized models with clean shading. Third, lower polygon counts directly improve performance — our game will run smoother even on weaker systems while keeping high environmental detail.\n\nWe keep pushing our boulder toward the summit — and now we do it with a bit more tech under the hood."
  },
  "ru": {
    "title": "Дневник разработки 2",
    "date": "16 Апр, 2026",
    "summary": "Дневник разработки #2: исследование пайплайнов переноса CAD-моделей в Blender и оптимизации полигональной сетки.",
    "body": "В инди-разработке оптимизация — это не просто финальный штрих перед релизом, а фундамент, на котором строится весь процесс создания контента. Недавно наш 3D-дизайнер провел большое исследование, посвященное проблеме, с которой сталкиваются многие студии: потере качества полигональной сетки при переносе CAD-моделей в Blender.\n\nПри стандартном экспорте (например, в формате OBJ) математически идеальная CAD-геометрия часто превращается в хаос: появляются лишние треугольники, неравномерная плотность ребер и артефакты на скруглениях. Это усложняет дальнейшую работу с шейдингом и развертками, а также бьет по производительности игры. Мы решили не мириться с этим и протестировали несколько пайплайнов на примере сложной модели с обилием фасок — винтажного холодильника Coca-Cola Vendo.\n\nКраткие итоги нашего исследования:\n\nБазовый экспорт (OBJ): Самый быстрый, но наименее качественный способ. Сетка получается неравномерной, углы и фаски обрастают избыточными полигонами, что требует долгой ручной чистки.\n\nPlasticity Bridge: Отличный инструмент для быстрых итераций и проверки изменений геометрии в реальном времени. При настройке параметров количество треугольников значительно снижается (в нашем тесте — с 62 тыс. до 16 тыс.), однако на сложных участках все еще остаются избыточные разрезы.\n\nОбработка через PIXYZ: Безусловный лидер тестирования. Программа сохраняет логику построения ребер (edge flow) и радикально снижает полигонаж (до 6,8 тыс. треугольников в нашем случае), выдавая чистую сетку, практически готовую для игрового движка.\n\nСекретный ингредиент: Мы выяснили, что качество тесселяции зависит не только от софта. Добавление дополнительных направляющих сечений еще на этапе CAD-моделирования «подсказывает» программе, как правильно интерпретировать сложные формы, сводя появление артефактов к минимуму.\n\nЧто это значит для нашего проекта?\n\nВнедрение PIXYZ в связке с предварительной подготовкой направляющих ребер в CAD полностью меняет наш пайплайн создания ассетов с жесткими поверхностями (hard surface).\n\nВо-первых, мы экономим часы рутинной работы. Моделлерам больше не нужно вручную чистить сгенерированную сетку (делать ретопологию), что позволяет направить сэкономленное время на создание новых механик и проработку деталей. Во-вторых, мы получаем максимально оптимизированные модели с чистым шейдингом. В-третьих, снижение полигонажа напрямую влияет на производительность — наша игра будет работать плавнее даже на слабых системах, сохраняя при этом высокую детализацию окружения.\n\nМы продолжаем толкать наш камень к вершине, и теперь делаем это чуточку технологичнее."
  }
}
